{
  "schema_version": 1,
  "bundle": {"id": "laya-multilingual", "version": "0.1.0"},
  "provenance": {
    "source_model": {
      "id": "convaiinnovations/laya-multilingual",
      "revision": "052592a15d198d9ad47da779604259b10b47b7aa"
    },
    "sdk": {
      "repository": "NandhaKishorM/laya",
      "revision": "573e5b62696ba441230cd6be71d593331b5d23af",
      "version": "0.3.5"
    },
    "profile": {
      "id": "laya-multilingual-v1",
      "sha256": "2dc717bbbf2bacb9c00d57f2ba7279c6a4332900bca84d12c000ebd6401a0235"
    },
    "exporter": {
      "name": "laya-go-export",
      "version": "1.0.0",
      "source_sha256": "1111111111111111111111111111111111111111111111111111111111111111",
      "git_revision": "2222222222222222222222222222222222222222"
    },
    "lock": {
      "path": "tools/export/uv.lock",
      "sha256": "3333333333333333333333333333333333333333333333333333333333333333"
    },
    "created_at": "2026-09-22T00:00:00Z",
    "source_date_epoch": 1790035200,
    "redistribution": "approved",
    "licenses": [
      {"component": "source-model", "spdx": "Apache-2.0", "path": "LICENSE.model"},
      {"component": "sdk-derived-exporter-code", "spdx": "Apache-2.0", "path": "LICENSE.sdk"}
    ]
  },
  "preprocessing": {
    "version": 1,
    "max_len": 1024,
    "head_max_len": 256,
    "option_max_len": 48,
    "head_reserve": 16,
    "truncation_side": "right",
    "qtypes": {"choice": 0, "score": 1, "noul": 2}
  },
  "model": {
    "path": "model.onnx",
    "format": "onnx",
    "opset": 18,
    "precision": "fp32",
    "external_data": [],
    "inputs": [
      {"name": "input_ids", "dtype": "int64", "dimensions": ["batch", "sequence"]},
      {"name": "attention_mask", "dtype": "int64", "dimensions": ["batch", "sequence"]},
      {"name": "marker_pos", "dtype": "int64", "dimensions": ["batch", "markers"]},
      {"name": "marker_mask", "dtype": "bool", "dimensions": ["batch", "markers"]},
      {"name": "qtype", "dtype": "int64", "dimensions": ["batch"]}
    ],
    "outputs": [
      {"name": "logits", "dtype": "float32", "dimensions": ["batch", "markers"]},
      {"name": "act_logits", "dtype": "float32", "dimensions": ["batch", "actions"]}
    ]
  },
  "tokenizer": {
    "json_path": "tokenizer/tokenizer.json",
    "config_path": "tokenizer/tokenizer_config.json",
    "special_tokens": {"cls": 2, "sep": 3, "mask": 4, "pad": 0}
  },
  "calibration": {
    "config_path": "rl_agent_config.json",
    "temperature_min": 0.5,
    "temperature_max": 5.0,
    "invalid_temperature": 1.0,
    "selection_order": ["option_bucket", "qtype", "default"],
    "actions": [{"index": 0, "id": "escalate"}]
  },
  "runtime": {
    "engine": "onnxruntime",
    "minimum_version": "1.20.0",
    "maximum_exclusive": "2.0.0",
    "execution_providers": ["CPUExecutionProvider"]
  },
  "files": [
    {"role": "license", "path": "LICENSE.model", "size": 1, "sha256": "8888888888888888888888888888888888888888888888888888888888888888"},
    {"role": "license", "path": "LICENSE.sdk", "size": 1, "sha256": "9999999999999999999999999999999999999999999999999999999999999999"},
    {"role": "notice", "path": "NOTICE.model", "size": 1, "sha256": "aaaaaaaaaaaaaaaaaaaaaaaaaaaaaaaaaaaaaaaaaaaaaaaaaaaaaaaaaaaaaaaa"},
    {"role": "notice", "path": "NOTICE.sdk", "size": 1, "sha256": "bbbbbbbbbbbbbbbbbbbbbbbbbbbbbbbbbbbbbbbbbbbbbbbbbbbbbbbbbbbbbbbb"},
    {"role": "model", "path": "model.onnx", "size": 1, "sha256": "4444444444444444444444444444444444444444444444444444444444444444"},
    {"role": "agent-config", "path": "rl_agent_config.json", "size": 1, "sha256": "7777777777777777777777777777777777777777777777777777777777777777"},
    {"role": "tokenizer", "path": "tokenizer/tokenizer.json", "size": 1, "sha256": "5555555555555555555555555555555555555555555555555555555555555555"},
    {"role": "tokenizer-config", "path": "tokenizer/tokenizer_config.json", "size": 1, "sha256": "6666666666666666666666666666666666666666666666666666666666666666"}
  ]
}
